{
  "research_question_id": "RQ-ASK-001-B",
  "original_question": "How to invest in Nvidia this month or SCHD?",
  "question_type": "COMPARISON_RESEARCH",
  "created_at": "2026-07-10T16:00:00Z",
  "requested_horizon": "THIS_MONTH",
  "user_objective_state": "UNKNOWN",
  "evidence_connection_state": "NOT_CONNECTED",
  "evidence_mode": "PLAN_ONLY",
  "action_boundary_state": "ACTION_LANGUAGE_DETECTED",
  "source_requirements": [
    "Nvidia: latest earnings/revenue growth, valuation context, AI/data center demand, margin trend, competitive risk, downside scenario",
    "SCHD: fund factsheet, holdings exposure, distribution history, expense ratio, yield mechanics, drawdown history, income-objective fit, tax/currency context"
  ],
  "evidence_records": [],
  "source_facts": [
    {
      "claim_id": "SF-001-B1",
      "claim_text": "Nvidia is single-company equity exposure.",
      "claim_classification": "SOURCE_FACT",
      "freshness_state": "UNKNOWN_FRESHNESS"
    },
    {
      "claim_id": "SF-001-B2",
      "claim_text": "SCHD is dividend ETF exposure.",
      "claim_classification": "SOURCE_FACT",
      "freshness_state": "UNKNOWN_FRESHNESS"
    }
  ],
  "source_interpretations": [],
  "labpal_interpretations": [
    {
      "claim_id": "LPI-001-B1",
      "claim_text": "Nvidia and SCHD are different types of exposure and are usually evaluated with different horizons and objectives.",
      "claim_classification": "LABPAL_INTERPRETATION",
      "freshness_state": "UNKNOWN_FRESHNESS"
    },
    {
      "claim_id": "LPI-001-B2",
      "claim_text": "This month is a short horizon; SCHD is typically evaluated differently from a short-term single-stock trade idea.",
      "claim_classification": "LABPAL_INTERPRETATION",
      "freshness_state": "UNKNOWN_FRESHNESS"
    },
    {
      "claim_id": "LPI-001-B3",
      "claim_text": "LabPal does not choose a winner between Nvidia and SCHD.",
      "claim_classification": "LABPAL_INTERPRETATION",
      "freshness_state": "UNKNOWN_FRESHNESS"
    }
  ],
  "unknowns": [
    "Current market data unavailable",
    "Current valuation unavailable",
    "User objective unclear",
    "Risk boundary unknown",
    "Suitability not reviewed",
    "No execution validity check"
  ],
  "stale_evidence_warnings": [],
  "action_boundary_warnings": [
    "Action language detected: invest. LabPal structures research only — no personalized buy/sell recommendation."
  ],
  "next_safe_actions": [
    "Clarify goal: income, growth, or short-term trade",
    "Clarify horizon: this month, 6 months, or 1 year",
    "Clarify DCA/income plan vs separate trade idea",
    "Clarify risk tolerance",
    "Compare as thesis, not recommendation"
  ],
  "clarification_required": [
    "Is your goal income, growth, or short-term trade?",
    "What time horizon do you actually mean: this month, 6 months, or 1 year?",
    "Is this for your DCA/income plan or a separate trade idea?",
    "How much risk can this decision take?"
  ],
  "exposure_notes": [
    "Nvidia: single-company equity exposure",
    "SCHD: dividend ETF exposure"
  ]
}
