{
  "research_question_id": "RQ-ASK-001-C",
  "original_question": "Which stocks are worth researching for the next 6 months?",
  "question_type": "CANDIDATE_DISCOVERY",
  "created_at": "2026-07-10T16:00:00Z",
  "requested_horizon": "6_MONTHS",
  "user_objective_state": "UNKNOWN",
  "evidence_connection_state": "MOCK_CONNECTED",
  "evidence_mode": "MOCK_EVIDENCE",
  "action_boundary_state": "RECOMMENDATION_RISK",
  "source_requirements": [
    "Sector or theme filter tied to objective",
    "Earnings growth evidence (sourced filings)",
    "Valuation context vs history and peers",
    "Balance sheet risk and leverage",
    "Catalyst calendar for 6-month horizon",
    "Downside scenario acceptance"
  ],
  "evidence_records": [
    {
      "evidence_id": "MOCK-DISC-001",
      "source_name": "Mock Research Criteria Feed",
      "source_url": "mock://labpal/mock/DISC-001",
      "source_type": "MOCK",
      "retrieved_at": "2026-07-10T16:00:00Z",
      "published_at": null,
      "freshness_state": "UNKNOWN_FRESHNESS",
      "asset_or_topic": "CANDIDATE_DISCOVERY",
      "claim_text": "[MOCK] Illustrative research-criteria checklist — not a stock pick list",
      "claim_classification": "LABPAL_INTERPRETATION",
      "source_quote_or_summary": "Mock criteria template only.",
      "labpal_notes": "MOCK_EVIDENCE — NOT LIVE DATA",
      "unknowns": ["No live screening feed connected"],
      "reliability_notes": "Prototype mock — do not use for market decisions.",
      "is_mock": true,
      "mock_label": "MOCK_EVIDENCE — NOT LIVE DATA"
    }
  ],
  "source_facts": [],
  "source_interpretations": [],
  "labpal_interpretations": [
    {
      "claim_id": "LPI-001-C1",
      "claim_text": "Candidate discovery outputs research criteria only — not stock recommendations.",
      "claim_classification": "LABPAL_INTERPRETATION",
      "freshness_state": "UNKNOWN_FRESHNESS"
    }
  ],
  "unknowns": [
    "User objective and risk boundary unknown",
    "No live candidate screening connected",
    "Suitability not reviewed"
  ],
  "stale_evidence_warnings": [],
  "action_boundary_warnings": [
    "Recommendation risk: question asks which stocks — LabPal must not output picks."
  ],
  "next_safe_actions": [
    "Define sector/theme filter",
    "State research criteria",
    "Preserve question without ticker list"
  ]
}
